{
  "id": "publishing-model-history",
  "version": "0.1.0",
  "schema": "/data/publishing/schemas/publishing.schema.json",
  "status": "foundation",
  "runtimeStatus": "not-consumed",
  "createdAt": "2026-07-10",
  "updatedAt": "2026-07-10",
  "owner": "Calcule Trabalhador",
  "source": "Productivity Layer Phase 2.6 - Publishing Model",
  "description": "Change history for the Publishing Model.",
  "items": [
    {
      "id": "publishing-model-0.1.0",
      "version": "0.1.0",
      "date": "2026-07-10",
      "status": "foundation",
      "changes": [
        "Created declarative Publishing Model.",
        "Defined lifecycle, gates, preview, review, approval, release, deploy, sitemap, indexing, rollback and logs.",
        "Kept production, sitemap, deploy and external indexing untouched."
      ]
    }
  ]
}
